{
  "task_id": "T-000N",
  "stage": "execute",
  "created_at": "2026-02-27T09:25:00Z",
  "result": "partial",
  "human_decision": "changes_requested",
  "token_cost": 18420,
  "latency": 72.5,
  "rework_count": 1,
  "failure_tags": [
    "weak_acceptance_criteria"
  ],
  "kpi_snapshot": {
    "accuracy": 0.78,
    "rework_rate": 1.3,
    "token_cost": 18420
  },
  "notes": "Output was promising but lacked concrete pass/fail thresholds."
}
